{"contract_name":"engine_staged_result","contract_version":1,"command_id":"command_alpha","command":"proposal_stage","snapshot_handle":"snapshot_handle_alpha","staged_handle":"staged_handle_alpha","input_digest":"aaaaaaaaaaaaaaaaaaaaaaaaaaaaaaaaaaaaaaaaaaaaaaaaaaaaaaaaaaaaaaaa","result_digest":"bbbbbbbbbbbbbbbbbbbbbbbbbbbbbbbbbbbbbbbbbbbbbbbbbbbbbbbbbbbbbbbb","status":"staged","findings":[]}
